{
  "$schema": "https://json-schema.org/draft/2020-12/schema",
  "$id": "platform/gemini-extension.schema.json",
  "title": "Gemini CLI extension manifest (gemini-extension.json) as generated by this repository",
  "description": "Maintained here. Derived from the Gemini CLI extension reference (https://geminicli.com/docs/extensions/reference/; mcpServers and ${extensionPath} checked 2026-10-14, settings checked 2026-10-22) and the manifest in github.com/microsoft/skills. Skill loading from extensions depends on the Gemini CLI version; see docs/platform-compatibility.md.",
  "type": "object",
  "required": ["name", "version", "description"],
  "additionalProperties": false,
  "properties": {
    "name": { "type": "string", "pattern": "^[a-z0-9]+(-[a-z0-9]+)*$" },
    "version": { "type": "string" },
    "description": { "type": "string" },
    "mcpServers": {
      "type": "object",
      "additionalProperties": {
        "type": "object",
        "additionalProperties": false,
        "properties": {
          "command": { "type": "string" },
          "args": { "type": "array", "items": { "type": "string" } },
          "httpUrl": { "type": "string", "pattern": "^https://" }
        }
      }
    },
    "settings": {
      "type": "array",
      "minItems": 1,
      "description": "Values Gemini CLI asks for when the extension is installed and passes to its MCP servers as the named environment variables. Sensitive values go to the system keychain.",
      "items": {
        "type": "object",
        "required": ["name", "description", "envVar"],
        "additionalProperties": false,
        "properties": {
          "name": { "type": "string", "minLength": 1 },
          "description": { "type": "string" },
          "envVar": { "type": "string", "pattern": "^[A-Z][A-Z0-9_]*$" },
          "sensitive": { "type": "boolean" }
        }
      }
    }
  }
}
